title,summary,published,authors,processed_summary
InternLM-XComposer2.5-OmniLive: A Comprehensive Multimodal System for Long-term Streaming Video and Audio Interactions,"Creating AI systems that can interact with environments over long periods,
similar to human cognition, has been a longstanding research goal. Recent
advancements in multimodal large language models (MLLMs) have made significant
strides in open-world understanding. However, the challenge of continuous and
simultaneous streaming perception, memory, and reasoning remains largely
unexplored. Current MLLMs are constrained by their sequence-to-sequence
architecture, which limits their ability to process inputs and generate
responses simultaneously, akin to being unable to think while perceiving.
Furthermore, relying on long contexts to store historical data is impractical
for long-term interactions, as retaining all information becomes costly and
inefficient. Therefore, rather than relying on a single foundation model to
perform all functions, this project draws inspiration from the concept of the
Specialized Generalist AI and introduces disentangled streaming perception,
reasoning, and memory mechanisms, enabling real-time interaction with streaming
video and audio input. The proposed framework InternLM-XComposer2.5-OmniLive
(IXC2.5-OL) consists of three key modules: (1) Streaming Perception Module:
Processes multimodal information in real-time, storing key details in memory
and triggering reasoning in response to user queries. (2) Multi-modal Long
Memory Module: Integrates short-term and long-term memory, compressing
short-term memories into long-term ones for efficient retrieval and improved
accuracy. (3) Reasoning Module: Responds to queries and executes reasoning
tasks, coordinating with the perception and memory modules. This project
simulates human-like cognition, enabling multimodal large language models to
provide continuous and adaptive service over time.",2024-12-12 18:58:30+00:00,"['Pan Zhang', 'Xiaoyi Dong', 'Yuhang Cao', 'Yuhang Zang', 'Rui Qian', 'Xilin Wei', 'Lin Chen', 'Yifei Li', 'Junbo Niu', 'Shuangrui Ding', 'Qipeng Guo', 'Haodong Duan', 'Xin Chen', 'Han Lv', 'Zheng Nie', 'Min Zhang', 'Bin Wang', 'Wenwei Zhang', 'Xinyue Zhang', 'Jiaye Ge', 'Wei Li', 'Jingwen Li', 'Zhongying Tu', 'Conghui He', 'Xingcheng Zhang', 'Kai Chen', 'Yu Qiao', 'Dahua Lin', 'Jiaqi Wang']",create ai system interact environment long period similar human cognition longstanding research goal recent advancement multimodal large language model mllm significant stride open world understanding challenge continuous simultaneous streaming perception memory reasoning remain largely unexplored current mllm constrain sequence sequence architecture limit ability process input generate response simultaneously akin unable think perceive furthermore rely long context store historical datum impractical long term interaction retain information costly inefficient rely single foundation model perform function project draw inspiration concept specialized generalist ai introduce disentangle stream perception reasoning memory mechanism enable real time interaction streaming video audio input propose framework internlm omnilive ol consist key module streaming perception module process multimodal information real time store key detail memory trigger reasoning response user query multi modal long memory module integrate short term long term memory compress short term memory long term one efficient retrieval improve accuracy reasoning module respond query execute reasoning task coordinate perception memory module project simulate human like cognition enable multimodal large language model provide continuous adaptive service time
Probing a diffuse flux of axion-like particles from galactic supernovae with neutrino water Cherenkov detectors,"In this article, we claim that axion-like particles (ALPs) with MeV masses
can be produced with semi-relativistic velocities in core-collapse supernovae
(SNe), generating a diffuse galactic flux. We show that these ALPs can be
detected in neutrino water Cherenkov detectors via $a \, p \rightarrow p \,
\gamma$ interactions. Using Super-Kamiokande data, we derive new constraints on
the ALP parameter space, excluding a region spanning more than one order of
magnitude in the ALP-proton coupling above cooling bounds for ALP masses in the
range of $1-80$ MeV and ALP-proton couplings between
$6\times10^{-6}-2\times10^{-4}$. We show that the future Hyper-Kamiokande will
be able to probe couplings as small as $2\times10^{-6}$, fully closing the
allowed region above SN 1987A cooling bounds.",2024-12-12 18:58:24+00:00,"['David Alonso-González', 'David Cerdeño', 'Marina Cermeño', 'Andres D. Perez']",article claim axion like particle alps mev masse produce semi relativistic velocity core collapse supernovae sne generate diffuse galactic flux alp detect neutrino water cherenkov detector p p interaction super kamiokande datum derive new constraint alp parameter space exclude region span order magnitude alp proton coupling cool bound alp masse range mev alp proton coupling future hyper kamiokande able probe coupling small fully close allow region sn cool bound
Wait-Less Offline Tuning and Re-solving for Online Decision Making,"Online linear programming (OLP) has found broad applications in revenue
management and resource allocation. State-of-the-art OLP algorithms achieve low
regret by repeatedly solving linear programming (LP) subproblems that
incorporate updated resource information. However, LP-based methods are
computationally expensive and often inefficient for large-scale applications.
In contrast, recent first-order OLP algorithms are more computationally
efficient but typically suffer from worse regret guarantees. To address these
shortcomings, we propose a new algorithm that combines the strengths of
LP-based and first-order OLP methods. The algorithm re-solves the LP
subproblems periodically at a predefined frequency $f$ and uses the latest dual
prices to guide online decision-making. In addition, a first-order method runs
in parallel during each interval between LP re-solves, smoothing resource
consumption. Our algorithm achieves $\mathscr{O}(\log (T/f) + \sqrt{f})$
regret, delivering a ""wait-less"" online decision-making process that balances
the computational efficiency of first-order methods and the superior regret
guarantee of LP-based methods.",2024-12-12 18:58:14+00:00,"['Jingruo Sun', 'Wenzhi Gao', 'Ellen Vitercik', 'Yinyu Ye']",online linear programming olp find broad application revenue management resource allocation state art olp algorithm achieve low regret repeatedly solve linear programming lp subproblem incorporate update resource information lp base method computationally expensive inefficient large scale application contrast recent order olp algorithm computationally efficient typically suffer bad regret guarantee address shortcoming propose new algorithm combine strength lp base order olp method algorithm solve lp subproblem periodically predefine frequency use late dual price guide online decision making addition order method run parallel interval lp solve smooth resource consumption algorithm achieve t f regret deliver wait online decision make process balance computational efficiency order method superior regret guarantee lp base method
Dissipative measure-valued solutions and weak-strong uniqueness for the Euler alignment system,"We introduce the concept of a dissipative measure-valued solution to the
Euler alignment system. This approach incorporates a modified total energy
balance, utilizing a binary tensor Young measure. The central finding is a weak
(measure-valued)--strong uniqueness principle: if both a dissipative
measure-valued solution and a classical smooth solution originate from the same
initial data, they will be identical as long as the classical solution exists.",2024-12-12 18:56:14+00:00,"['Abhishek Chaudhary', 'Ujjwal Koley', 'Emil Wiedemann']",introduce concept dissipative measure value solution euler alignment system approach incorporate modify total energy balance utilize binary tensor young measure central finding weak measure uniqueness principle dissipative measure value solution classical smooth solution originate initial datum identical long classical solution exist
Gaze-LLE: Gaze Target Estimation via Large-Scale Learned Encoders,"We address the problem of gaze target estimation, which aims to predict where
a person is looking in a scene. Predicting a person's gaze target requires
reasoning both about the person's appearance and the contents of the scene.
Prior works have developed increasingly complex, hand-crafted pipelines for
gaze target estimation that carefully fuse features from separate scene
encoders, head encoders, and auxiliary models for signals like depth and pose.
Motivated by the success of general-purpose feature extractors on a variety of
visual tasks, we propose Gaze-LLE, a novel transformer framework that
streamlines gaze target estimation by leveraging features from a frozen DINOv2
encoder. We extract a single feature representation for the scene, and apply a
person-specific positional prompt to decode gaze with a lightweight module. We
demonstrate state-of-the-art performance across several gaze benchmarks and
provide extensive analysis to validate our design choices. Our code is
available at: http://github.com/fkryan/gazelle .",2024-12-12 18:55:30+00:00,"['Fiona Ryan', 'Ajay Bati', 'Sangmin Lee', 'Daniel Bolya', 'Judy Hoffman', 'James M. Rehg']",address problem gaze target estimation aim predict person look scene predict person gaze target require reasoning person appearance content scene prior work develop increasingly complex hand craft pipeline gaze target estimation carefully fuse feature separate scene encoder head encoder auxiliary model signal like depth pose motivate success general purpose feature extractor variety visual task propose gaze lle novel transformer framework streamline gaze target estimation leverage feature frozen encoder extract single feature representation scene apply person specific positional prompt decode gaze lightweight module demonstrate state art performance gaze benchmark provide extensive analysis validate design choice code available
BaB-ND: Long-Horizon Motion Planning with Branch-and-Bound and Neural Dynamics,"Neural-network-based dynamics models learned from observational data have
shown strong predictive capabilities for scene dynamics in robotic manipulation
tasks. However, their inherent non-linearity presents significant challenges
for effective planning. Current planning methods, often dependent on extensive
sampling or local gradient descent, struggle with long-horizon motion planning
tasks involving complex contact events. In this paper, we present a
GPU-accelerated branch-and-bound (BaB) framework for motion planning in
manipulation tasks that require trajectory optimization over neural dynamics
models. Our approach employs a specialized branching heuristics to divide the
search space into subdomains, and applies a modified bound propagation method,
inspired by the state-of-the-art neural network verifier alpha-beta-CROWN, to
efficiently estimate objective bounds within these subdomains. The branching
process guides planning effectively, while the bounding process strategically
reduces the search space. Our framework achieves superior planning performance,
generating high-quality state-action trajectories and surpassing existing
methods in challenging, contact-rich manipulation tasks such as non-prehensile
planar pushing with obstacles, object sorting, and rope routing in both
simulated and real-world settings. Furthermore, our framework supports various
neural network architectures, ranging from simple multilayer perceptrons to
advanced graph neural dynamics models, and scales efficiently with different
model sizes.",2024-12-12 18:55:14+00:00,"['Keyi Shen', 'Jiangwei Yu', 'Huan Zhang', 'Yunzhu Li']",neural network base dynamic model learn observational datum show strong predictive capability scene dynamic robotic manipulation task inherent non linearity present significant challenge effective planning current planning method dependent extensive sampling local gradient descent struggle long horizon motion planning task involve complex contact event paper present gpu accelerate branch bind bab framework motion plan manipulation task require trajectory optimization neural dynamic model approach employ specialized branching heuristic divide search space subdomain apply modify bind propagation method inspire state art neural network verifier alpha beta crown efficiently estimate objective bound subdomain branching process guide plan effectively bounding process strategically reduce search space framework achieve superior planning performance generate high quality state action trajectory surpass exist method challenging contact rich manipulation task non prehensile planar push obstacle object sorting rope route simulated real world setting furthermore framework support neural network architecture range simple multilayer perceptron advanced graph neural dynamic model scale efficiently different model size
Gradient-Boosted Mixture Regression Models for Postprocessing Ensemble Weather Forecasts,"Nowadays, weather forecasts are commonly generated by ensemble forecasts
based on multiple runs of numerical weather prediction models. However, such
forecasts are usually miscalibrated and/or biased, thus require statistical
postprocessing. Non-homogeneous regression models, such as the ensemble model
output statistics are frequently applied to correct these forecasts.
Nonetheless, these methods often rely on the assumption of an unimodal
parametric distribution, leading to improved, but sometimes not fully
calibrated forecasts. To address this issue, a mixture regression model is
presented, where the ensemble forecasts of each exchangeable group are linked
to only one mixture component and mixture weight, called mixture of model
output statistics (MIXMOS). In order to remove location specific effects and to
use a longer training data, the standardized anomalies of the response and the
ensemble forecasts are employed for the mixture of standardized anomaly model
output statistics (MIXSAMOS). As carefully selected covariates, e.g. from
different weather variables, can enhance model performance, the non-cyclic
gradient-boosting algorithm for mixture regression models is introduced.
Furthermore, MIXSAMOS is extended by this gradient-boosting algorithm
(MIXSAMOS-GB) providing an automatic variable selection. The novel mixture
regression models substantially outperform state-of-the-art postprocessing
models in a case study for 2m surface temperature forecasts in Germany.",2024-12-12 18:54:56+00:00,['David Jobst'],nowadays weather forecast commonly generate ensemble forecast base multiple run numerical weather prediction model forecast usually miscalibrate biased require statistical postprocessing non homogeneous regression model ensemble model output statistic frequently apply correct forecast nonetheless method rely assumption unimodal parametric distribution lead improve fully calibrate forecast address issue mixture regression model present ensemble forecast exchangeable group link mixture component mixture weight call mixture model output statistic mixmos order remove location specific effect use long training datum standardized anomaly response ensemble forecast employ mixture standardized anomaly model output statistic mixsamos carefully select covariate different weather variable enhance model performance non cyclic gradient boost algorithm mixture regression model introduce furthermore mixsamos extend gradient boost algorithm mixsamo gb provide automatic variable selection novel mixture regression model substantially outperform state art postprocessing model case study m surface temperature forecast germany
Neptune: The Long Orbit to Benchmarking Long Video Understanding,"This paper describes a semi-automatic pipeline to generate challenging
question-answer-decoy sets for understanding long videos. Many existing video
datasets and models are focused on short clips (10s-30s). While some long video
datasets do exist, they can often be solved by powerful image models applied
per frame (and often to very few frames) in a video, and are usually manually
annotated at high cost. In order to mitigate both these problems, we propose a
scalable dataset creation pipeline which leverages large models (VLMs and
LLMs), to automatically generate dense, time-aligned video captions, as well as
tough question answer decoy sets for video segments (up to 15 minutes in
length). Our dataset Neptune covers a broad range of long video reasoning
abilities and consists of a subset that emphasizes multimodal reasoning. Since
existing metrics for open-ended question answering are either rule-based or may
rely on proprietary models, we provide a new open source model-based metric GEM
to score open-ended responses on Neptune. Benchmark evaluations reveal that
most current open-source long video models perform poorly on Neptune,
particularly on questions testing temporal ordering, counting and state
changes. Through Neptune, we aim to spur the development of more advanced
models capable of understanding long videos. The dataset is available at
https://github.com/google-deepmind/neptune",2024-12-12 18:54:48+00:00,"['Arsha Nagrani', 'Mingda Zhang', 'Ramin Mehran', 'Rachel Hornung', 'Nitesh Bharadwaj Gundavarapu', 'Nilpa Jha', 'Austin Myers', 'Xingyi Zhou', 'Boqing Gong', 'Cordelia Schmid', 'Mikhail Sirotenko', 'Yukun Zhu', 'Tobias Weyand']",paper describe semi automatic pipeline generate challenging question answer decoy set understand long video exist video dataset model focus short clip long video dataset exist solve powerful image model apply frame frame video usually manually annotate high cost order mitigate problem propose scalable dataset creation pipeline leverage large model vlm llms automatically generate dense time align video caption tough question answer decoy set video segment minute length dataset neptune cover broad range long video reasoning ability consist subset emphasize multimodal reasoning exist metric open ended question answering rule base rely proprietary model provide new open source model base metric gem score open end response neptune benchmark evaluation reveal current open source long video model perform poorly neptune particularly question test temporal ordering counting state change neptune aim spur development advanced model capable understand long video dataset available
Optical Arbitrary Waveform Generation (OAWG) Using Actively Phase-Stabilized Spectral Stitching,"The conventional way of generating optical waveforms relies on the in-phase
and quadrature (IQ) modulation of a continuous wave (CW) laser tone. In this
case, the bandwidth of the resulting optical waveform is limited by the
underlying electronic components, in particular by the digital-to-analog
converters (DACs) generating the drive signals for the IQ modulator. This
bandwidth bottleneck can be overcome by using a concept known as optical
arbitrary waveform generation (OAWG), where multiple IQ modulators and DACs are
operated in parallel to first synthesize individual spectral slices, which are
subsequently combined to form a single ultra-broadband arbitrary optical
waveform. However, targeted synthesis of arbitrary optical waveforms from
multiple spectral slices has so far been hampered by difficulties to maintain
the correct optical phase relationship between the slices. In this paper, we
propose and demonstrate spectrally sliced OAWG with active phase stabilization,
which permits targeted synthesis of truly arbitrary optical waveforms. We
demonstrate the viability of the scheme by synthesizing optical waveforms with
record-high bandwidths of up to 325 GHz from four individually generated
optical tributaries. In a proof-of-concept experiment, we use the OAWG system
to generate 32QAM data signals at symbol rates of up to 320 GBd, which we
transmit over 87 km of single-mode fiber and receive by a two-channel
non-sliced optical arbitrary waveform measurement (OAWM) system, achieving
excellent signal quality. We believe that our scheme can unlock the full
potential of OAWG and disrupt a wide range of applications in high-speed
optical communications, photonic-electronic digital-to-analog conversion, as
well as advanced test and measurement in science and industry.",2024-12-12 18:54:32+00:00,"['Daniel Drayss', 'Dengyang Fang', 'Alban Sherifaj', 'Huanfa Peng', 'Christoph Füllner', 'Thomas Henauer', 'Grigory Lihachev', 'Tobias Harter', 'Wolfgang Freude', 'Sebastian Randel', 'Tobias J. Kippenberg', 'Thomas Zwick', 'Christian Koos']",conventional way generate optical waveform rely phase quadrature iq modulation continuous wave cw laser tone case bandwidth result optical waveform limit underlie electronic component particular digital analog converter dacs generate drive signal iq modulator bandwidth bottleneck overcome concept know optical arbitrary waveform generation oawg multiple iq modulator dac operate parallel synthesize individual spectral slice subsequently combine form single ultra broadband arbitrary optical waveform target synthesis arbitrary optical waveform multiple spectral slice far hamper difficulty maintain correct optical phase relationship slice paper propose demonstrate spectrally slice oawg active phase stabilization permit target synthesis truly arbitrary optical waveform demonstrate viability scheme synthesize optical waveform record high bandwidth ghz individually generate optical tributary proof concept experiment use oawg system generate datum signal symbol rate gbd transmit km single mode fiber receive channel non sliced optical arbitrary waveform measurement oawm system achieve excellent signal quality believe scheme unlock potential oawg disrupt wide range application high speed optical communication photonic electronic digital analog conversion advanced test measurement science industry
A Theoretical Analysis of Soft-Label vs Hard-Label Training in Neural Networks,"Knowledge distillation, where a small student model learns from a pre-trained
large teacher model, has achieved substantial empirical success since the
seminal work of \citep{hinton2015distilling}. Despite prior theoretical studies
exploring the benefits of knowledge distillation, an important question remains
unanswered: why does soft-label training from the teacher require significantly
fewer neurons than directly training a small neural network with hard labels?
To address this, we first present motivating experimental results using simple
neural network models on a binary classification problem. These results
demonstrate that soft-label training consistently outperforms hard-label
training in accuracy, with the performance gap becoming more pronounced as the
dataset becomes increasingly difficult to classify. We then substantiate these
observations with a theoretical contribution based on two-layer neural network
models. Specifically, we show that soft-label training using gradient descent
requires only $O\left(\frac{1}{\gamma^2 \epsilon}\right)$ neurons to achieve a
classification loss averaged over epochs smaller than some $\epsilon > 0$,
where $\gamma$ is the separation margin of the limiting kernel. In contrast,
hard-label training requires $O\left(\frac{1}{\gamma^4} \cdot
\ln\left(\frac{1}{\epsilon}\right)\right)$ neurons, as derived from an adapted
version of the gradient descent analysis in \citep{ji2020polylogarithmic}. This
implies that when $\gamma \leq \epsilon$, i.e., when the dataset is challenging
to classify, the neuron requirement for soft-label training can be
significantly lower than that for hard-label training. Finally, we present
experimental results on deep neural networks, further validating these
theoretical findings.",2024-12-12 18:54:07+00:00,"['Saptarshi Mandal', 'Xiaojun Lin', 'R. Srikant']",knowledge distillation small student model learn pre train large teacher model achieve substantial empirical success seminal work despite prior theoretical study explore benefit knowledge distillation important question remain unanswered soft label training teacher require significantly few neuron directly train small neural network hard label address present motivate experimental result simple neural network model binary classification problem result demonstrate soft label training consistently outperform hard label training accuracy performance gap pronounced dataset increasingly difficult classify substantiate observation theoretical contribution base layer neural network model specifically soft label training gradient descent require neuron achieve classification loss average epoch small separation margin limit kernel contrast hard label training require neuron derive adapt version gradient descent analysis imply dataset challenge classify neuron requirement soft label training significantly low hard label training finally present experimental result deep neural network validate theoretical finding
